{
  "id": "tropes",
  "source": "fn main() {\n    let a: i32 = -7;\n    let b: i32 = 2;\n    println!(\"{} {} | {} {}\", a / b, a % b, a.div_euclid(b), a.rem_euclid(b));\n}",
  "topic": "Integer arithmetic",
  "difficulty_requested": 3,
  "options": [
    {
      "text": "-3 -1 | -3 -1",
      "kind": "output",
      "why_tempting": "If div_euclid looks like just another name for /, both sides of the pipe come out truncated. It isn't another name — it floors, and the pipe is there to force the comparison."
    },
    {
      "text": "-4 1 | -4 1",
      "kind": "output",
      "why_tempting": "Python's // floors toward negative infinity, so -7 // 2 is -4 there. Carry that habit into Rust and / looks floored too — but Rust's / truncates toward zero."
    },
    {
      "text": "does not compile",
      "kind": "does_not_compile",
      "why_tempting": "div_euclid and rem_euclid are real methods on integers that have been there for years. If either name looked invented, this is where you'd land. Neither is."
    },
    {
      "text": "-3 1 | -4 -1",
      "kind": "output",
      "why_tempting": "If you remember that the two divisions disagree but misremember which remainder keeps the dividend's sign, every sign lands exactly backwards."
    },
    {
      "text": "-3 -1 | -4 1",
      "kind": "output"
    }
  ],
  "hint": "Rust has two different notions of division for signed integers, and they disagree here. Which one do / and % use?",
  "explains": {
    "what": "Rust's / and % truncate toward zero, so -7 / 2 loses the fraction and the remainder keeps the sign of the number being divided. div_euclid and rem_euclid round the other way, down, which is what makes their remainder come back positive.",
    "takeaway": "Don't worry: this is literally the whole idea. Both are real division and both satisfy the same identity: the quotient times the divisor plus the remainder gets you back where you started. They only disagree about which way to round. If you have ever indexed into a ring buffer with a negative offset, you have met this.",
    "legacy": "Rust's / and % truncate toward zero, so -7 / 2 is -3, and the remainder takes the sign of the dividend: -1. div_euclid and rem_euclid floor instead, giving -4 with a remainder that is always non-negative: 1. Both are correct division -- they satisfy the same identity a == b * q + r -- they just make different choices about which way to round. If you have ever indexed into a ring buffer with a negative offset, you have met this bug."
  },
  "trace": {
    "steps": [
      {
        "lines": [
          2
        ],
        "focus": [
          2,
          3
        ],
        "note": "Start with -7. The minus sign is the part to watch.",
        "values": [
          {
            "name": "a",
            "was": "—",
            "now": "-7"
          }
        ]
      },
      {
        "lines": [
          3
        ],
        "focus": [
          2,
          3
        ],
        "note": "Now a divisor of 2. Seven doesn't split evenly by two, so each operation on the next line has to decide what to do with the half.",
        "values": [
          {
            "name": "b",
            "was": "—",
            "now": "2"
          }
        ]
      },
      {
        "lines": [
          4
        ],
        "focus": [
          4,
          4
        ],
        "note": "One line works out four numbers: two with operators, two with methods. Same inputs each time. Do the pairs agree?",
        "values": []
      },
      {
        "lines": [
          4
        ],
        "focus": [
          4,
          4
        ],
        "note": "/ drops the fraction by rounding toward zero. -3.5 becomes -3, not -4.",
        "values": [
          {
            "name": "a / b",
            "was": "—",
            "now": "-3"
          }
        ]
      },
      {
        "lines": [
          4
        ],
        "focus": [
          4,
          4
        ],
        "note": "% is what's left over from that division, so a == b * q + r still holds: -7 - (2 * -3) = -1. The remainder keeps the sign of a.",
        "values": [
          {
            "name": "a % b",
            "was": "—",
            "now": "-1"
          }
        ]
      },
      {
        "lines": [
          4
        ],
        "focus": [
          4,
          4
        ],
        "note": "div_euclid picks the quotient that leaves a remainder of zero or more. With a positive divisor like ours, that means rounding down, so -3.5 becomes -4. Same division, rounded the other way. This is the step the question turns on.",
        "values": [
          {
            "name": "a.div_euclid(b)",
            "was": "—",
            "now": "-4"
          }
        ],
        "pivot": true
      },
      {
        "lines": [
          4
        ],
        "focus": [
          4,
          4
        ],
        "note": "rem_euclid is the leftover that goes with that rounding: -7 - (2 * -4) = 1. Never negative, which is its whole point.",
        "values": [
          {
            "name": "a.rem_euclid(b)",
            "was": "—",
            "now": "1"
          }
        ]
      },
      {
        "lines": [
          4
        ],
        "focus": [
          4,
          4
        ],
        "note": "All four print on one line, in the order they were written.",
        "values": [
          {
            "name": "stdout",
            "was": "—",
            "now": "-3 -1 | -4 1"
          }
        ]
      }
    ]
  },
  "verified": {
    "rustc": "rustc 1.98.1 (48a229cea 2026-09-01)\nbinary: rustc\ncommit-hash: 48a229ceaefd4985c50990b14116b6d856af0985\ncommit-date: 2026-09-01\nhost: aarch64-unknown-linux-gnu\nrelease: 1.98.1\nLLVM version: 22.1.8",
    "edition": "2021",
    "target_triple": "aarch64-unknown-linux-gnu",
    "flags": {
      "opt_level": "0",
      "overflow_checks": true,
      "debug_assertions": true
    },
    "runs": {
      "count": 5,
      "byte_identical": true
    },
    "stdout": "-3 -1 | -4 1\n",
    "exit_code": 0,
    "miri": {
      "clean": true,
      "output_matched": true,
      "version": "miri 0.1.0 (420ed2a0c3 2026-09-18)",
      "configs": [
        "stacked_borrows"
      ],
      "seeds": [
        0
      ]
    },
    "verified_at": "2026-09-30T08:28:13Z",
    "verifier_version": "popquiz-verify 7b1bc351e4dd"
  },
  "review": {
    "reason": "Review-test fixture copied from bank/questions/q4 on 2026-10-12; not a bank record. Its takeaway carries 11.1 tropes, which warn and block nothing (D-23)."
  }
}
