{
  "id": "q8",
  "source": "fn main() {\n    let mut v = vec![1, 2, 3];\n    let first = &v[0];\n    v.push(4);\n    println!(\"{}\", first);\n}",
  "topic": "Borrow checking",
  "difficulty_requested": 3,
  "options": [
    {
      "text": "1",
      "kind": "output",
      "why_tempting": "The most natural read: first borrows v[0], push appends without touching it, println reads the borrow. If the borrow checker never crosses your mind, 1 is the whole story."
    },
    {
      "text": "4",
      "kind": "output",
      "why_tempting": "If you think push reallocates the buffer and first follows the data — reading whatever now sits where v[0] was — you'd expect the new element. The borrow never gets that far."
    },
    {
      "text": "[1, 2, 3, 4]",
      "kind": "output",
      "why_tempting": "If you misread `first` as the vector itself rather than a borrow of one element, the println looks like a debug print of the whole thing after the push."
    },
    {
      "text": "panics at runtime",
      "kind": "panic",
      "why_tempting": "If you believe the borrow checker only warns and the real failure comes when push moves the buffer out from under first, you'd expect a crash at runtime instead of a compile error. The refusal happens before the program ever runs."
    },
    {
      "text": "does not compile",
      "kind": "does_not_compile"
    }
  ],
  "hint": "Ask what push might need to do to the vector's storage, and what that would mean for anything already pointing into it.",
  "explains": {
    "what": "&v[0] is a shared borrow pointing into the vector's heap buffer. push needs the vector mutably and may move that buffer somewhere else to grow it, which would leave the borrow pointing at freed memory. The borrow checker refuses it before the program ever runs.",
    "takeaway": "The borrow is only still alive because it is used after the push. Delete the last line and the same program compiles - that is non-lexical lifetimes, and it is why this error seems to move around when you edit lines that look unrelated.",
    "legacy": "&v[0] takes a shared borrow pointing into the vector's heap buffer. push needs &mut v and may reallocate that buffer to grow it -- which would leave `first` dangling at a freed address. The borrow checker rejects this at compile time with E0502: cannot borrow `v` as mutable because it is also borrowed as immutable. The detail worth arguing about: the borrow is only still alive because `first` is USED after the push. Delete the final println and the same program compiles -- that is non-lexical lifetimes, and it is why this error moves around when you edit seemingly unrelated lines."
  },
  "trace": {
    "steps": []
  },
  "verified": {
    "rustc": "rustc 1.98.1 (48a229cea 2026-09-01)\nbinary: rustc\ncommit-hash: 48a229ceaefd4985c50990b14116b6d856af0985\ncommit-date: 2026-09-01\nhost: aarch64-unknown-linux-gnu\nrelease: 1.98.1\nLLVM version: 22.1.8",
    "edition": "2021",
    "target_triple": "aarch64-unknown-linux-gnu",
    "flags": {
      "opt_level": "0",
      "overflow_checks": true,
      "debug_assertions": true
    },
    "compile_error_code": [
      "E0502"
    ],
    "verified_at": "2026-10-03T23:38:21Z",
    "verifier_version": "popquiz-verify 7b1bc351e4dd"
  },
  "review": {
    "reason": "Review-test fixture copied from bank/questions/q8 on 2026-10-12; not a bank record.",
    "status": "accepted"
  }
}
